{"ledger_id":"EQA-LEDGER-EXAMPLE-001","run_id":"EQA-RUN-EXAMPLE-001","node_ids":["EQA-NODE-CE-001"],"completed_node_ids":["EQA-NODE-CE-001"],"deferred_node_ids":[],"blocked_node_ids":[],"stale_node_ids":[],"finding_ids":["EQA-FND-EXAMPLE-001"],"disagreement_ids":[],"decision_ids":["EQA-DEC-EXAMPLE-001"],"receipt_ids":["EQA-REC-EXAMPLE-001"],"open_blocks":[],"human_decisions_required":[],"coverage_statement":"CE and TE inventory checked; substantive truth excluded.","residual_risk":"moderate","release_decision":"ready_with_tracked_items","created_at":"2026-08-14T00:00:00Z","supersedes":null}
